{
  "schema_version": "2.0.0",
  "directive_id": "018f1e2d-3c4b-7a05-8c9d-001122334459",
  "session_id": "018f1e2d-3c4b-7a02-8c9d-001122334456",
  "tenant_id": "018f1e2d-3c4b-7a01-8c9d-001122334455",
  "target_presenter_id": "018f1e2d-3c4b-7a04-8c9d-001122334458",
  "posture": "listening",
  "facial_expression": "attentive",
  "gaze": "participant",
  "gesture": "micro_nod",
  "vocal_style": "calm",
  "pause_ms": 260,
  "duration_ms": 1800,
  "reason": "Participante ainda está explicando o contexto.",
  "priority": 60,
  "generated_at": "2026-07-14T20:00:00Z",
  "expires_at": "2026-07-14T20:05:00Z"
}
